{
  "schema_version": "1.0",
  "title": "为什么输电阻塞会造成不同节点电价？",
  "hook": "同样一度电，为什么在电网的不同位置会出现不同价格？",
  "summary": "节点边际电价衡量在特定位置额外增加一单位负荷给系统带来的最小运行成本。在忽略网损等因素的理想无阻塞条件下，各节点的边际价格可以相同；但关键线路拥塞后，便宜电源可能无法继续向远处输送，系统必须调整机组出力，使不同位置的增量供电成本出现差异。这种价差既与发电成本有关，也反映了网络约束的经济作用。",
  "topic_type": "technical",
  "tags": [
    "电力市场",
    "电力系统",
    "优化理论"
  ],
  "key_takeaways": [
    "节点电价是节点负荷边际变化引起的系统最优成本变化，而非简单的当地机组报价。",
    "输电阻塞使各节点对有限输电能力的依赖不同，从而可能造成节点价差。",
    "分析节点价格必须说明模型假设，如是否考虑网损、潮流约束与对偶变量符号约定。"
  ],
  "branches": [
    {
      "id": "b1",
      "title": "直觉：为什么位置会改变电的价值？",
      "summary": "电网不是没有容量限制的统一铜板。",
      "content": "设想甲地有成本较低的电源，乙地负荷较高。若甲乙之间的输电通道仍有余量，系统可以提高甲地出力向乙地送电。若线路达到容量上限，乙地新增负荷就可能需要由更昂贵的资源承担；于是不同位置增加一单位负荷的成本不再相同。",
      "children": [
        {
          "id": "b1-1",
          "title": "一个两区域示意",
          "summary": "用低成本区域与高成本区域理解拥塞。",
          "content": "这个示意仅强调边际机制：假如低成本区域还有机组出力能力，但连接线路已经满载，高成本区域新增负荷不能简单由低成本机组承担。真实电网中还会存在环流、网损、多个约束同时生效等因素。",
          "children": []
        }
      ]
    },
    {
      "id": "b2",
      "title": "节点边际价格的优化含义",
      "summary": "通过经济调度最优值与约束对偶变量解释电价。",
      "content": "在给定机组约束、网络约束与运行条件时，节点边际价格通常可解释为节点负荷微小增加导致的最优系统成本变化。在相应的优化模型与符号约定下，这一边际量与节点功率平衡约束的对偶变量相关。",
      "children": [
        {
          "id": "b2-1",
          "title": "阻塞影子价格是什么？",
          "summary": "网络容量约束放松的边际价值。",
          "content": "影子价格表示在局部有效的优化条件下，适度放宽某项约束对最优目标值的边际影响。它不是由线路单独决定的最终节点电价，而需要结合潮流灵敏度和价格表达式分析。",
          "children": []
        }
      ]
    },
    {
      "id": "b3",
      "title": "模型假设与边界",
      "summary": "何时能够说无阻塞则电价相同？",
      "content": "简化的无损 DC-OPF 模型常把节点价格分解为系统能量价格和拥塞分量。若进一步考虑边际网损、不同市场机制或非凸运行约束，价格结构会更加复杂。任何确定性结论都需要先说明模型适用范围。",
      "children": []
    },
    {
      "id": "b4",
      "title": "进一步思考",
      "summary": "把工程约束与经济激励联系起来。",
      "content": "节点电价可以为负荷响应、发电选址和电网投资提供经济信号，但价格信号并不直接等于某个投资项目的社会净收益。长期决策还应考虑可靠性、投资成本和监管安排。",
      "children": []
    }
  ],
  "faq": [
    {
      "question": "无阻塞时所有节点电价一定相同吗？",
      "answer": "在理想、无损且采用统一边际定价规则的模型中可能相同；如果纳入边际网损等因素，则仍可能出现差异。",
      "basis": "supplement"
    },
    {
      "question": "节点价格较高是否意味着当地发电机报价更高？",
      "answer": "不一定。线路容量限制及其对供电替代关系的影响，也可能推高某个节点的边际供电成本。",
      "basis": "supplement"
    },
    {
      "question": "输电线路扩容是否一定降低所有节点电价？",
      "answer": "不一定。扩容可能减轻拥塞，但各节点价格变化取决于系统负荷、发电报价、其他网络约束和运行时段。",
      "basis": "supplement"
    },
    {
      "question": "为什么会引入影子价格？",
      "answer": "影子价格帮助解释约束资源的边际经济价值。对输电约束而言，可以用它分析放宽容量限制对最优调度成本的影响。",
      "basis": "supplement"
    },
    {
      "question": "DC-OPF 是否能完全刻画真实电网运行？",
      "answer": "不能。DC-OPF 为便于分析通常采用近似假设，无法替代对无功、电压、损耗和其他 AC 运行条件的完整考察。",
      "basis": "supplement"
    },
    {
      "question": "这张示例卡片是否来自真实的 ChatGPT 对话？",
      "answer": "不是。它是用于测试结构、内容渲染和导入功能的演示数据，不应被当作任何真实聊天的摘要。",
      "basis": "conversation"
    }
  ],
  "caveats": [
    "本文件是格式测试用的演示卡片，不对应任何实际用户对话。",
    "关于节点电价的说明采用概念化表述，具体市场规则可能不同。"
  ],
  "source": {
    "chat_title": "【演示数据】电力节点电价",
    "chat_url": null
  }
}
