{
  "schema_version": "1.0",
  "title": "Mindflow B 公开合成长正文滚动测试",
  "hook": "这是一张公开合成测试卡，不含私人聊天。",
  "summary": "用于试运行导入、搜索、收藏、知识树和FAQ操作。这里只包含合成数据。",
  "topic_type": "technical",
  "tags": [
    "合成",
    "work验收"
  ],
  "key_takeaways": [
    "只用于非生产体验。",
    "本机数据不会上传。"
  ],
  "branches": [
    {
      "id": "long-root",
      "title": "合成根节点",
      "summary": "进入知识树阅读。",
      "content": "这是公开合成正文。\n\n## 阅读要点\n\n- 保留原始测试数据\n- 检查本机保存状态\n\n**非生产环境**",
      "children": [
        {
          "id": "long-child",
          "title": "合成子节点",
          "summary": "测试展开、阅读和返回。",
          "content": "这是子节点正文，可以返回知识树继续浏览。",
          "children": [
            {
              "id": "long-grandchild",
              "title": "合成第三级长正文",
              "summary": "公开合成滚动内容",
              "content": "合成段落 001：仅用于验收正文滚动和阅读位置；不包含私人信息。\n\n合成段落 002：仅用于验收正文滚动和阅读位置；不包含私人信息。\n\n合成段落 003：仅用于验收正文滚动和阅读位置；不包含私人信息。\n\n合成段落 004：仅用于验收正文滚动和阅读位置；不包含私人信息。\n\n合成段落 005：仅用于验收正文滚动和阅读位置；不包含私人信息。\n\n合成段落 006：仅用于验收正文滚动和阅读位置；不包含私人信息。\n\n合成段落 007：仅用于验收正文滚动和阅读位置；不包含私人信息。\n\n合成段落 008：仅用于验收正文滚动和阅读位置；不包含私人信息。\n\n合成段落 009：仅用于验收正文滚动和阅读位置；不包含私人信息。\n\n合成段落 010：仅用于验收正文滚动和阅读位置；不包含私人信息。\n\n合成段落 011：仅用于验收正文滚动和阅读位置；不包含私人信息。\n\n合成段落 012：仅用于验收正文滚动和阅读位置；不包含私人信息。\n\n合成段落 013：仅用于验收正文滚动和阅读位置；不包含私人信息。\n\n合成段落 014：仅用于验收正文滚动和阅读位置；不包含私人信息。\n\n合成段落 015：仅用于验收正文滚动和阅读位置；不包含私人信息。\n\n合成段落 016：仅用于验收正文滚动和阅读位置；不包含私人信息。\n\n合成段落 017：仅用于验收正文滚动和阅读位置；不包含私人信息。\n\n合成段落 018：仅用于验收正文滚动和阅读位置；不包含私人信息。\n\n合成段落 019：仅用于验收正文滚动和阅读位置；不包含私人信息。\n\n合成段落 020：仅用于验收正文滚动和阅读位置；不包含私人信息。\n\n合成段落 021：仅用于验收正文滚动和阅读位置；不包含私人信息。\n\n合成段落 022：仅用于验收正文滚动和阅读位置；不包含私人信息。\n\n合成段落 023：仅用于验收正文滚动和阅读位置；不包含私人信息。\n\n合成段落 024：仅用于验收正文滚动和阅读位置；不包含私人信息。\n\n合成段落 025：仅用于验收正文滚动和阅读位置；不包含私人信息。\n\n合成段落 026：仅用于验收正文滚动和阅读位置；不包含私人信息。\n\n合成段落 027：仅用于验收正文滚动和阅读位置；不包含私人信息。\n\n合成段落 028：仅用于验收正文滚动和阅读位置；不包含私人信息。\n\n合成段落 029：仅用于验收正文滚动和阅读位置；不包含私人信息。\n\n合成段落 030：仅用于验收正文滚动和阅读位置；不包含私人信息。\n\n合成段落 031：仅用于验收正文滚动和阅读位置；不包含私人信息。\n\n合成段落 032：仅用于验收正文滚动和阅读位置；不包含私人信息。\n\n合成段落 033：仅用于验收正文滚动和阅读位置；不包含私人信息。\n\n合成段落 034：仅用于验收正文滚动和阅读位置；不包含私人信息。\n\n合成段落 035：仅用于验收正文滚动和阅读位置；不包含私人信息。\n\n合成段落 036：仅用于验收正文滚动和阅读位置；不包含私人信息。\n\n合成段落 037：仅用于验收正文滚动和阅读位置；不包含私人信息。\n\n合成段落 038：仅用于验收正文滚动和阅读位置；不包含私人信息。\n\n合成段落 039：仅用于验收正文滚动和阅读位置；不包含私人信息。\n\n合成段落 040：仅用于验收正文滚动和阅读位置；不包含私人信息。\n\n合成段落 041：仅用于验收正文滚动和阅读位置；不包含私人信息。\n\n合成段落 042：仅用于验收正文滚动和阅读位置；不包含私人信息。\n\n合成段落 043：仅用于验收正文滚动和阅读位置；不包含私人信息。\n\n合成段落 044：仅用于验收正文滚动和阅读位置；不包含私人信息。\n\n合成段落 045：仅用于验收正文滚动和阅读位置；不包含私人信息。\n\n合成段落 046：仅用于验收正文滚动和阅读位置；不包含私人信息。\n\n合成段落 047：仅用于验收正文滚动和阅读位置；不包含私人信息。\n\n合成段落 048：仅用于验收正文滚动和阅读位置；不包含私人信息。\n\n合成段落 049：仅用于验收正文滚动和阅读位置；不包含私人信息。\n\n合成段落 050：仅用于验收正文滚动和阅读位置；不包含私人信息。\n\n合成段落 051：仅用于验收正文滚动和阅读位置；不包含私人信息。\n\n合成段落 052：仅用于验收正文滚动和阅读位置；不包含私人信息。\n\n合成段落 053：仅用于验收正文滚动和阅读位置；不包含私人信息。\n\n合成段落 054：仅用于验收正文滚动和阅读位置；不包含私人信息。\n\n合成段落 055：仅用于验收正文滚动和阅读位置；不包含私人信息。\n\n合成段落 056：仅用于验收正文滚动和阅读位置；不包含私人信息。\n\n合成段落 057：仅用于验收正文滚动和阅读位置；不包含私人信息。\n\n合成段落 058：仅用于验收正文滚动和阅读位置；不包含私人信息。\n\n合成段落 059：仅用于验收正文滚动和阅读位置；不包含私人信息。\n\n合成段落 060：仅用于验收正文滚动和阅读位置；不包含私人信息。\n\n合成段落 061：仅用于验收正文滚动和阅读位置；不包含私人信息。\n\n合成段落 062：仅用于验收正文滚动和阅读位置；不包含私人信息。\n\n合成段落 063：仅用于验收正文滚动和阅读位置；不包含私人信息。\n\n合成段落 064：仅用于验收正文滚动和阅读位置；不包含私人信息。\n\n合成段落 065：仅用于验收正文滚动和阅读位置；不包含私人信息。\n\n合成段落 066：仅用于验收正文滚动和阅读位置；不包含私人信息。\n\n合成段落 067：仅用于验收正文滚动和阅读位置；不包含私人信息。\n\n合成段落 068：仅用于验收正文滚动和阅读位置；不包含私人信息。\n\n合成段落 069：仅用于验收正文滚动和阅读位置；不包含私人信息。\n\n合成段落 070：仅用于验收正文滚动和阅读位置；不包含私人信息。\n\n合成段落 071：仅用于验收正文滚动和阅读位置；不包含私人信息。\n\n合成段落 072：仅用于验收正文滚动和阅读位置；不包含私人信息。\n\n合成段落 073：仅用于验收正文滚动和阅读位置；不包含私人信息。\n\n合成段落 074：仅用于验收正文滚动和阅读位置；不包含私人信息。\n\n合成段落 075：仅用于验收正文滚动和阅读位置；不包含私人信息。\n\n合成段落 076：仅用于验收正文滚动和阅读位置；不包含私人信息。\n\n合成段落 077：仅用于验收正文滚动和阅读位置；不包含私人信息。\n\n合成段落 078：仅用于验收正文滚动和阅读位置；不包含私人信息。\n\n合成段落 079：仅用于验收正文滚动和阅读位置；不包含私人信息。\n\n合成段落 080：仅用于验收正文滚动和阅读位置；不包含私人信息。",
              "children": []
            }
          ]
        }
      ]
    }
  ],
  "faq": [
    {
      "question": "这些是真实私人数据吗？",
      "answer": "不是。这是公开的合成验收数据。",
      "basis": "supplement"
    },
    {
      "question": "下载请求是否代表备份已保存？",
      "answer": "不代表，请检查下载记录并重新验证完整文件。",
      "basis": "supplement"
    }
  ],
  "caveats": [
    "不代表正式生产发布。"
  ],
  "source": {
    "chat_title": null,
    "chat_url": null
  }
}